created_at,username,full_text,cleaned_text
Thu Feb 20 05:19:54 +0000 2025,BillArqam,bikin kebijakannya kek coba coba anjirrr dari ppn 12% ampe efisiensi itu emg ga ada yg nasehatin apa gmn sih kalo kebijakan bgitu bakal ditentang rakyat,bikin kebijakan kek coba coba anjirrr ppn 12 ampe efisiensi emg tidak ada nasehatin apa bagaimana sih kalau kebijakan bgitu bakal tentang rakyat
Thu Feb 20 03:35:24 +0000 2025,menumpahkan,[ADVOTALK] Hey there IKOMERS️ Dinas Advokasi dan Sosial Politik hadir dengan Advotalk sebuah podcast yang kali ini membahas mengenai Policy and Impact: PPN 12% . Kebijakan mengenai naiknya PPN menjadi 12% langsung menjadi perbincangan di berbagai kalangan- https://t.co/jNv51u4n4h,advotalk hai there ikomers dinas advokasi sosial politik hadir advotalk buah podcast kali bahas kena policy and impact ppn 12 kebijakan kena naik ppn jadi 12 langsung jadi bincang bagai kalang
Thu Feb 20 01:57:37 +0000 2025,hxxawvr,Naik kereta api emang jadi pilihan yang paling nyaman dan pastinya aman buat kamu yang mau bepergian. Tapi setiap kebijakan pemerintah pasti ada maksudnya kan? Adanya kenaikan PPN ini juga bagian dari upaya agar subsidi untuk masyarakat bisa lebih tepat sasaran dan merata.,naik kereta api emang jadi pilih paling nyaman pasti aman buat kamu mau pergi tiap kebijakan perintah ada maksud kan ada naik ppn juga bagi upaya subsidi masyarakat lebih tepat sasar rata
Thu Feb 20 00:52:23 +0000 2025,edisart4,@detikcom Yth Bapak Jenderal Luhut ; Bukan Sorga- Neraka pak Jenderal sebagai militer kalo buat kebijakan pantang surut ke pantai c/ Ppn 11% diprotes lsg keder hanya brg tertentu semua retail udah setting 11% pak skrg ttp 11% pak agak laen mmg...,yth bapak jenderal luhut bukan sorga neraka pak jenderal militer kalau buat kebijakan pantang surut pantai c ppn 11 protes lsg keder bareng tentu semua retail udah setting 11 pak skrg ttp 11 pak laen mmg
Wed Feb 19 17:12:18 +0000 2025,llakunaa,Udah gede harusnya tahu kalau yang baru belum tentu bagus. Lagian udh 4 bulan sejak pres dilantik. Udh ad bnyk kebijakan ngaco. Ada yg ditarik-ulur kyk PPN 12% dan gas melon. Ada jg yg masih lanjut kyk MBG dan pemotongan anggaran yg bikin rugi utamanya bid. edukasi + kesehatan.,udah gede harus tahu kalau baru tentu bagus lagi udah 4 bulan sejak pres lantik udah bnyk kebijakan ngaco tarik ulur kayak ppn 12 gas melon jg masih lanjut kayak mbg potong anggaran yang bikin rugi utama bid edukasi sehat
Wed Feb 19 14:18:58 +0000 2025,viicarnation,@rmol_id Bikin kebijakan tanpa riset dahulu jd kyk yoyo ingat kenaikan ppn n gas 3 kg kmrn??di forum internasional bilg RI korupsinya sdh parah sekali lah di dlm negeri malah hidup jokowi finalis occrp pidatonya cuma omon2 tok,bikin kebijakan riset jd kayak yoyo ingat naik ppn n gas 3 kilogram kmrn forum internasional bilg ri korupsi sdh parah sekali lah dalam negeri malah hidup jokowi final occrp pidato cuma omon2 tok
Wed Feb 19 13:25:18 +0000 2025,Ay4mGor3ng,Kebijakan si gemoy tidak lahir dari naskah akademik dan kajian para ahli. Tpi kebijakannya diambil dari cek ombak. Contoh : kenaikan PPn 12% dan kelangkaan LPG 3kg,kebijakan si gemoy lahir naskah akademik kaji ahli tpi kebijakan ambil cek ombak contoh naik ppn 12 langka lpg 3kg
Wed Feb 19 12:03:01 +0000 2025,ardi_tama1,Kegiatan ini bertujuan untuk memastikan penggunaan barang elektronik lebih efisien dan sesuai dengan kebijakan efisiensi anggaran dari Presiden. Dengan adanya upaya ini diharapkan operasional pelabuhan dapat berjalan lebih optimal dan berkelanjutan.,giat tuju pasti guna barang elektronik lebih efisien sesuai kebijakan efisiensi anggaran presiden ada upaya harap operasional labuh jalan lebih optimal lanjut
Wed Feb 19 11:29:58 +0000 2025,ImaIsBack,Mereka terlalu fokus ama hal negatif dan tutup mata terhadap hal yg positip. Nuduh Prabowo anti kritik padahal udah berapa kali Prabowo melakukan koreksi di level eksekusi dan bahkan kebijakan? Masih ingat PPN 12% LPG dan anggaran yg diefisienkan? Masih banyak yg lain kan?,terlalu fokus ama negatif tutup mata hal positip nuduh prabowo anti kritik padahal udah berapa kali prabowo laku koreksi level eksekusi bahkan kebijakan ingat ppn 12 lpg anggaran efisien banyak lain kan
Wed Feb 19 05:09:19 +0000 2025,LuxuryBroz,@ferrykoto @prabowo Diskon listrik baru muncul semenjak ribut ppn 11%. Kyaknya blan kebijakan tapi buat meredam gejolak saja. THR ASN sudah ada PP No. 14 tahun 2024 jadi bukan kebijakan tapi keharusan. Bansos sudah dsri jaman SBY ada.,diskon listrik baru muncul semenjak ribut ppn 11 kyaknya blan kebijakan buat redam gejolak thr asn pp no 14 tahun 2024 jadi bukan kebijakan harus bansos dsri jaman sby ada
Wed Feb 19 03:54:03 +0000 2025,VKapris96904,@mooonlinaa Ya udah sih. Mau sampai kapan marah penyesalan. Kalau kita dewasa berdemokrasi. Kawal habis. Kritik habis. Toh ternyata jalan juga kan. Setiap kebijakan bodoh kita marah2 akhirnya dirubah. Ppn LPG Kip-K dll. Kalau cuma menyesal marah2 mah g ngerubah apa2,udah sih mau kapan marah sesal kalau dewasa demokrasi kawal habis kritik habis nyata jalan kan kebijakan bodoh marah2 akhir rubah ppn lpg kip dan lain kalau cuma sesal marah2 mah g ngerubah apa2
Wed Feb 19 03:19:24 +0000 2025,kenzork99,@barengwarga https://t.co/zV7nN4KaUb tambahan reformasi kebijakan perpajakan demi masyarakat kalo bisa push terbitkan PP mengubah tarif minimal PPN 5% &amp; tolak kebijakan akrobat PPN 12% ciptakan kondisi perpajakan yang adil transparan &amp; akuntable dan kepastian hukum yang jelas,tambah reformasi kebijakan paja masyarakat kalau push terbit pp ubah tarif minimal ppn 5 amp tolak kebijakan akrobat ppn 12 cipta kondisi paja adil transparan amp akuntable pasti hukum jelas
Wed Feb 19 01:08:16 +0000 2025,M_Mrohman,@Yurissa_Samosir @woda_johan @Gerindra @choymarkochoy @ay_prakasa2225 @JamalBoegis @msaid_didu @AmaluddinSSili1 @nomerorae @Boediantar4 @yaniarsim @Panitia68285950 @PutriKayan16645 Lho kemarin kalian buat kebijakan gila dri pagar laut PPN 12% LPG apa pake otak gk Kritik malah dianggap musuh https://t.co/GK7xR3PjQ6,lho kemarin kalian buat kebijakan gila pagar laut ppn 12 lpg apa pake otak kritik malah anggap musuh
Wed Feb 19 01:03:40 +0000 2025,Onews272726,Cara kerjanya tuh diredam di buat biasa aja gak jadi viral jalan deh kebijakan. Soalnya kalo viral kebijakannya gak jadi jalan kaya ppn lpg3kg dll,cara kerja tuh redam buat biasa aja tidak jadi viral jalan deh kebijakan soal kalau viral kebijakan tidak jadi jalan kaya ppn lpg3kg lain
Tue Feb 18 16:48:03 +0000 2025,pajakdlksanggul,@Susustroberri @nozelism Anjing memang. Sumpah diemin klo ada kebijakan ppn naik antri gas... Oposisi diam,sensor memang sumpah diemin klo kebijakan ppn naik antri gas oposisi diam
Tue Feb 18 16:13:05 +0000 2025,Para2_Goblok58,@merekamcahaya tolong dijawab apa yang dirusak? MBG investasi SDM jangka panjang PPN gak jadi naik oke tapi kudu efisiensi 10% dari anggaran yang 90% nya ATK kalian demo kebijakan blunder bahlil langsung dicabut hanya dalam 2-3 hari ... jadi apa sih?,jawab apa rusak mbg investasi sdm jangka panjang ppn tidak jadi naik oke kudu efisiensi 10 anggaran 90 nya atk kalian demo kebijakan blunder bahlil langsung cabut dalam 2 3 hari jadi apa sih
Tue Feb 18 12:16:23 +0000 2025,soloposdotcom,@Jateng_Twit Demo gak ngefekk!! Yang ngefek itu revolusi. Caranya: Diemin saja kebijakan tolol pemerintah. Biar klo ppn naik gas antri.. dll nanti... 58% merasakan akibatnya... Tercipta revolusi. Fair ada korban di sisi 58% juga jadi gak cuma oposisi aja.,demo tidak ngefekk ngefek revolusi cara diemin kebijakan tolol perintah biar klo ppn naik gas antri lain 58 rasa akibat cipta revolusi fair korban sisi 58 jadi tidak cuma oposisi aja
Tue Feb 18 11:57:32 +0000 2025,permatagaravilg,@grtmassofclr_ Anda lihat keberhasilan oposisi: ppn 12% gak jadi Gas gak lagi antri Terus mereka enak lagi ngata2in oposisi. Gtu aja terussssss.. Diemin aja mulyono cs bikin kebijakan tolol itu. Biarkan mereka 58% ikut melawan. Ga sadar2 soalnya,lihat hasil oposisi ppn 12 tidak jadi gas tidak lagi antri terus enak ngata2in oposisi gtu aja terussssss diemin aja mulyono cs bikin kebijakan tolol biar 58 ikut lawan tidak sadar2 soal
Tue Feb 18 11:56:46 +0000 2025,Mamuju_Terampil,@conservathick Anda lihat keberhasilan oposisi: ppn 12% gak jadi Gas gak lagi antri Terus mereka enak lagi ngata2in oposisi. Gtu aja terussssss.. Diemin aja mulyono cs bikin kebijakan tolol itu. Biarkan mereka 58% ikut melawan. Ga sadar2 soalnya,lihat hasil oposisi ppn 12 tidak jadi gas tidak lagi antri terus enak ngata2in oposisi gtu aja terussssss diemin aja mulyono cs bikin kebijakan tolol biar 58 ikut lawan tidak sadar2 soal
Tue Feb 18 11:53:36 +0000 2025,AyuMari01776944,@BlckRosamund @BudiBukanIntel Kalian lihat keberhasilan oposisi: ppn 12% gak jadi Gas gak lagi antri Terus mereka enak lagi ngata2in oposisi. Gtu aja terussssss.. Diemin aja mulyono cs bikin kebijakan tolol itu. Biarkan mereka melawan balik.,kalian lihat hasil oposisi ppn 12 tidak jadi gas tidak lagi antri terus enak ngata2in oposisi gtu aja terussssss diemin aja mulyono cs bikin kebijakan tolol biar lawan balik
Tue Feb 18 11:47:52 +0000 2025,Azulaaaaaaaz,@metanoven @cutemistakess Kalian lihat keberhasilan oposisi: ppn 12% gak jadi Gas gak lagi antri Terus mereka enak lagi ngata2in oposisi. Gtu aja terussssss.. Diemin aja mulyono cs bikin kebijakan tolol itu.,kalian lihat hasil oposisi ppn 12 tidak jadi gas tidak lagi antri terus enak ngata2in oposisi gtu aja terussssss diemin aja mulyono cs bikin kebijakan tolol
Tue Feb 18 11:31:24 +0000 2025,Fanilove_R93,@DedynurPalakka Wkwkwkw padahal sinyalnya udah jelas Pas chaos karena kebijakan gas kemarin dan rencana ppn 12%. Dibatalkan krn banyak yang ga setuju. Setelah ngebatalin berlagak kek pahlawan.,wkwkwkw padahal sinyal udah jelas pas chaos kebijakan gas kemarin rencana ppn 12 batal krn banyak tidak tuju ngebatalin lagak kek pahlawan
Tue Feb 18 08:52:42 +0000 2025,drafdigital,@sayasukasih Wkwkw gue kira kebijakan ini tu bakalan sama kaya nasibnya ppn 12% yang ujung nya nggak jadi sampe pada akhirnya hari ini gue jadi salah satu korban dari efisiensi ini wkwk gue barusan disuruh ngajar dengan upahnya terima kasih buat semester depan karena duitnya udah nggak ada,tertawa gue kira kebijakan tu sama kaya nasib ppn 12 ujung nya jadi sampe akhir hari gue jadi salah satu korban efisiensi wkwk gue barusan suruh ngajar upah terima kasih buat semester depan duit udah ada
Tue Feb 18 08:40:55 +0000 2025,luarnalarmu,Komisi VII DPR RI DPR Dukung Penyesuaian Penerapan Kebijakan PPN 12% - TVR 120 https://t.co/JybiMg5ezO,komisi vii dpr ri dpr dukung sesuai terap kebijakan ppn 12 tvr 120
Tue Feb 18 08:40:17 +0000 2025,SitiSumiran,Pimpinan DPR RI : Kebijakan Kenaikan PPN 12% Harus Selektif - TVR 120 https://t.co/igHk94SlS8,pimpin dpr ri kebijakan naik ppn 12 selektif tvr 120
Tue Feb 18 04:29:54 +0000 2025,Jennife83085830,IKN (yg udah nggunduli hutan dan 140T/ Agustus tahun lalu) mangkrak Huru-hara PPN 12% Gas melon Efisiensi (pemecatan perpustakaan pada tutup) Kebijakan menteri kontroversial MBG yg ngorbanin segala-galanya sekaligus jadi lahan basah korupsi Pendidikan dan kesehatan cuma jadi--,ikn udah nggunduli hutan 140t agustus tahun lalu mangkrak huru hara ppn 12 gas melon efisiensi pecat pustaka tutup kebijakan menteri kontroversial mbg ngorbanin segala gala sekaligus jadi lahan basah korupsi pendidikan sehat cuma jadi
Tue Feb 18 02:54:55 +0000 2025,DroneEmpritOffc,Gas bumi adalah solusi energi bersih yang terjangkau untuk rakyat Indonesia. __ Dengan kebijakan Bebas PPN sesuai PP No. 49 Tahun 2022 PGN memastikan tidak ada tambahan beban pajak bagi pelanggan kami: #BUMNuntukIndonesia #GASuntukRakyat #Pertamina #EnergizingYou https://t.co/0BEJnLrX62,gas bumi solusi energi bersih terjangkau rakyat indonesia kebijakan bebas ppn sesuai pp no 49 tahun 2022 pgn pasti ada tambah beban pajak langgan
Tue Feb 18 00:44:49 +0000 2025,GudangKripto_ID,Kenaikan PPN yang mencekik kebijakan lingkungan yang merusak efisiensi tapi malah banyak stafsus peraturan distribusi gas yang berubah-ubah. Ekonomi kerasa makin berat dengan keputusan pemerintah yang rasanya ga bijak Ini serius nih 58% warga milih mereka?,naik ppn cekik kebijakan lingkung rusak efisiensi malah banyak stafsus atur distribusi gas ubah ubah ekonomi rasa makin berat putus perintah rasa tidak kebijakan serius nih 58 warga milih
Tue Feb 18 00:07:20 +0000 2025,lynxluna,Saya masih yakin kebijakan ekonomi pak prabowo ini benar ya : 1. Ppn masih di 11% 2. Menjaga harga gabah. Ini petani dikampung senang luar biasa. 3. Efisiensi Dan danantara.,yakin kebijakan ekonomi pak prabowo benar 1 ppn masih di 11 2 jaga harga gabah tani kampung senang luar biasa 3 efisiensi danantara
Mon Feb 17 13:45:14 +0000 2025,DiboWil30915477,Sejak awal 2025 pemerintah banyak mengeluarkan kebijakan-kebijakan yang membuat masyarakat geram. Mulai dari PPN 12 persen wacana perluasan kelapa sawit penarikan gas elpiji hingga yang terbaru efisiensi anggaran yang memotong banyak anggaran pendidikan. https://t.co/ehMprRnAs6,sejak awal 2025 perintah banyak keluar kebijakan kebijakan buat masyarakat geram mulai ppn 12 persen wacana luas kelapa sawit tari gas elpiji hingga baru efisiensi anggaran potong banyak anggaran pendidikan
Mon Feb 17 12:32:02 +0000 2025,alex_62812,Hidup macam apa ini? Pajak orang kaya diberi ampunan sedangkan pajak rakyat kecil ingin dinaikkan. Jurang ketimpangan antara si kaya dan si miskin akan semakin melebar. Untuk itu kebijakan PPN 12% ini perlu adanya pengkajian ulang agar tidak memperdalam jurang kemiskinan. . https://t.co/md1pjymQOh,hidup macam apa pajak orang kaya beri ampun pajak rakyat kecil naik jurang timpang si kaya si miskin makin lebar itu kebijakan ppn 12 perlu ada kaji ulang tidak dalam jurang miskin
Mon Feb 17 12:29:15 +0000 2025,nabilprcl,1. Kenaikan PPN 12% untung ga jadi. tapi skrg udah kebaca polanya bikin kebijakan kontroversi terus revisi. 2. Memaafkan Koruptor - bahkan dengan gamblang bilang koruptor boleh diam2 minta maaf ke dia ga melalui lembaga negara yg sah.,1 naik ppn 12 untung tidak jadi skrg udah baca pola bikin kebijakan kontroversi terus revisi 2 maaf koruptor bahkan gamblang bilang koruptor diam2 minta maaf dia tidak lalu lembaga negara sah
Mon Feb 17 11:16:44 +0000 2025,digital_skola,@um_fess Oh one more kehidupan masyarakat tuh shifting nya NGGAK NUNGGU konfirmasi the so called pemangku kebijakan. Isu PPN 12% kapan hari aja contohnya ya udah bikin kepanikan. Banyak harga di pasar udah naik duluan karena harga tuh naiknya nggak mungkin tenggo. Stop shallow.,one more hidup masyarakat tuh shifting nya nunggu konfirmasi the so called mang kebijakan isu ppn 12 kapan hari aja contoh udah bikin panik banyak harga pasar udah naik duluan harga tuh naik mungkin tenggo stop shallow
Mon Feb 17 09:54:14 +0000 2025,uniang_kamek,Hai #SahabatBahari Pada apel pagi (17/2/2025) Kepala Pelabuhan menyampaikan terkait kebijakan pemerintah dalam rangka efisiensi anggaran. Sebagai ASN kita harus mendukung dan mengikuti kebijakan yang telah ditetapkan. #PanganBiru #2025KKPRiseTogether https://t.co/A9wwWchTXn,hai apel pagi 17 2 2025 kepala labuh sampai kait kebijakan perintah rangka efisiensi anggaran asn harus dukung ikut kebijakan telah tetap
Mon Feb 17 09:03:06 +0000 2025,kamila58602,Hai #SahabatBahari PPN Sibolga pastikan bahwa kebijakan Efisiensi Anggaran tidak berdampak terhadap SDM (khususnya PPNPN PJLP dan Tenaga Outsourcing) https://t.co/Jo9XjsXtCm,hai ppn sibolga pasti kebijakan efisiensi anggaran dampak sdm khusus ppnpn pjlp tenaga outsourcing
Mon Feb 17 05:00:00 +0000 2025,afterseyks,Yuk kita update info kebijakan efisiensi anggaran ini #SahabatBahari,yuk update info kebijakan efisiensi anggaran
Mon Feb 17 04:57:36 +0000 2025,kppntgredeb,serta biaya kuliah mahasiswa dan sejumlah beasiswa lainnya seperti KIP LPDP hingga UKT perguruan tinggi tidak akan mengalami pemotongan atau pengurangan anggaran imbas kebijakan efisiensi.,biaya kuliah mahasiswa jumlah beasiswa lain kip lpdp hingga ukt guru tinggi akan alami potong kurang anggaran imbas kebijakan efisiensi
Mon Feb 17 04:55:38 +0000 2025,BUMNJogjaSigap,Seperti KIP LPDP hingga UKT perguruan tinggi tidak akan mengalami pemotongan atau pengurangan anggaran imbas kebijakan efisiensi. #PanganBiru #2025KKPRiseTogether #EkonomiBiruUntukIndonesiaEmas #SaktiWahyuTrenggono #EfisiensiAnggaran,kip lpdp hingga ukt guru tinggi akan alami potong kurang anggaran imbas kebijakan efisiensi
Mon Feb 17 04:54:32 +0000 2025,suarakeadilan88,#SahabatBahari sudah tau update terbaru terkait Kebijakan Efisiensi Anggaran? Cek video ini sampai selesai ya!! #DJPTDisiplin #DJPTBerdedikasi #DJPTBerprestasi #KKP2025RiseTogether #PanganBiru #PenangkapanIkanTerukur #ppntanjungpandan #sikembang https://t.co/4aUzIgo50R,tau update baru kait kebijakan efisiensi anggaran cek video sampai selesai
Mon Feb 17 04:28:43 +0000 2025,pajaktolitoli,#KawanPajak ingin tahu apa saja yang termasuk barang mewah? Pajak Pertambahan Nilai (PPN) 12% hanya dikenakan pada barang mewah. Sedangkan pada barang dan jasa lainnya nilai PPN tetap sama. Yuk pelajari lebih lanjut tentang kebijakan ini pada video berikut. https://t.co/z6SQklEdFX,tahu apa yang masuk barang mewah pajak tambah nilai ppn 12 kena barang mewah pada barang jasa lain nilai ppn tetap sama yuk ajar lebih lanjut kebijakan pada video ikut
Mon Feb 17 03:23:13 +0000 2025,PajakSumbawa,Seperti KIP LPDP hingga UKT perguruan tinggi tidak akan mengalami pemotongan atau pengurangan anggaran imbas kebijakan efisiensi. #PanganBiru #2025KKPRiseTogether #EkonomiBiruUntukIndonesiaEmas #SaktiWahyuTrenggono #EfisiensiAnggaran,kip lpdp hingga ukt guru tinggi akan alami potong kurang anggaran imbas kebijakan efisiensi
Mon Feb 17 03:01:07 +0000 2025,psisonderpt2,#KawanPajak PPN atas layanan streaming bukan pajak baru. Untuk golongan bukan barang mewah nilai PPN terutang masih sama seperti sebelumnya. Kebijakan ini merupakan bentuk keadilan bagi masyarakat. Yuk pelajari lebih lanjut tentang kebijakan PPN layanan digital! https://t.co/tJ7pG33bvg,ppn atas layanan streaming bukan pajak baru golong bukan barang mewah nilai ppn utang sama belum kebijakan rupa bentuk adil masyarakat yuk ajar lebih lanjut kebijakan ppn layanan digital
Mon Feb 17 02:57:49 +0000 2025,harapanrakyat_,#KawanPajak yuk kenali perbedaan aturan PPN terbaru! Pemerintah terus menyesuaikan kebijakan perpajakan agar tetap adil. https://t.co/DH9as53fPc,yuk kenal beda atur ppn baru perintah terus sesuai kebijakan paja tetap adil
Mon Feb 17 02:07:49 +0000 2025,ldfebui,seperti KIP LPDP hingga UKT perguruan tinggi tidak akan mengalami pemotongan atau pengurangan anggaran imbas kebijakan efisiensi. Efisiensi anggaran ini tertuang pada Inpres Nomor 1 Tahun 2025 tentang Efisiensi Belanja dalam Pelaksanaan APBN serta APBD) TA 2025.,kip lpdp hingga ukt guru tinggi akan alami potong kurang anggaran imbas kebijakan efisiensi efisiensi anggaran tuang inpres nomor 1 tahun 2025 efisiensi belanja laksana apbn apbd ta 2025
Mon Feb 17 01:25:48 +0000 2025,INDONESIAPERKS4,Kebijakan pemangkasan anggaran terutama pendidikan dan kesehatan akan berdampak terhadap buruh. Kebijakan pemangkasan subsidi BBM kenaikan PPN kenaikan iuran BPJS akan berdampak terhadap buruh. https://t.co/ThHSnb9r1m,kebijakan mangkas anggaran utama pendidikan sehat dampak buruh kebijakan mangkas subsidi bbm naik ppn naik iur bpjs dampak buruh
Sun Feb 16 10:30:05 +0000 2025,ratihbudiarto,PPN hanya dikenakan pada broker fee atau jasa lain yang memfasilitasi transaksi. Kebijakan ini mencerminkan keadilan sekaligus mendukung pertumbuhan pasar keuangan. Dengan pajak #UangKita yang kita bayarkan kita turut bergotong royong membangun negeri. https://t.co/15ZOdwBdxH,ppn kena broker fee jasa fasilitas transaksi kebijakan cermin adil sekaligus dukung tumbuh pasar uang pajak yang bayar kita turut gotong royong bangun negeri
Sun Feb 16 10:18:55 +0000 2025,radaraktual,#KawanPajak PPN atas layanan streaming bukan pajak baru. Untuk golongan bukan barang mewah nilai PPN terutang masih sama seperti sebelumnya. Kebijakan ini merupakan bentuk keadilan bagi masyarakat. Yuk pelajari lebih lanjut tentang kebijakan PPN layanan digital di video ini. https://t.co/jd3JG6cZMF,ppn atas layanan streaming bukan pajak baru golong bukan barang mewah nilai ppn utang sama belum kebijakan rupa bentuk adil masyarakat yuk ajar lebih lanjut kebijakan ppn layanan digital video
Sun Feb 16 09:47:19 +0000 2025,riduanmikhaelh,Sementara penerapan tarif PPN 12% khusus untuk Barang Mewah agar memberikan sisi keadilan. Pahami lebih lanjut kebijakan terbaru ini untuk memastikan kewajiban perpajakan #KawanPajak tetap terlaksana sesuai dengan peraturan PPN terbaru. https://t.co/ZKQfwQbAh6,terap tarif ppn 12 khusus barang mewah beri sisi adil paham lebih lanjut kebijakan baru untuk pasti wajib paja tetap laksana sesuai atur ppn baru
Sun Feb 16 09:47:18 +0000 2025,WMotret77701,Pemerintah terus menyesuaikan kebijakan perpajakan agar tetap adil. Aturan PPN terbaru dirancang untuk tetap selektif dengan perlindungan kepada barang kebutuhan pokok layanan kesehatan dan pendidikan tetap bebas PPN untuk melindungi seluruh masyarakat.,perintah terus sesuai kebijakan paja tetap adil atur ppn baru rancang tetap selektif lindung barang butuh pokok layanan sehat pendidikan tetap bebas ppn lindung seluruh masyarakat
Sun Feb 16 09:13:25 +0000 2025,pajakmanna,@CNNIndonesia prett wo 120 hari lu jadi presiden gada kebijakan lu yg bener semuanya ngaco PPN TAPERA GAS LPG EFISIENSI nggak viral dan diributin dulu gabakal dibatalin lu emang suka ngaco bikin kebijakan dikatain kabinet gemuk gaterima emang kabinet lu isinya kek tai semua,prett wo 120 hari lu jadi presiden gada kebijakan lu bener semua ngaco ppn tapera gas lpg efisiensi viral diributin dulu gabakal dibatalin lu emang suka ngaco bikin kebijakan dikatain kabinet gemuk gaterima emang kabinet lu isi kek tai semua
Sun Feb 16 03:27:35 +0000 2025,jovianary,@msaid_didu kami dr lembaga khusus pajak INTAC menyampaikan bahwa sistem pajak Indonesia sudah dikuasai sekelompok orang yg menunggangi kebijakan pajak. Masyarakat menjadi obyek yg mudah dibohongi atas kenaikan PPN 12% https://t.co/Mh36HlUP1K,dr lembaga khusus pajak intac sampai sistem pajak indonesia asai kelompok orang tunggang kebijakan pajak masyarakat jadi obyek mudah bohong atas naik ppn 12
Sun Feb 16 01:10:39 +0000 2025,Mpok_Hanum,@Schultzz07 @ardisatriawan Rakyat dikira bego kayak pas pilpres kmaren mentah2 milih 02. Jd pda kira rakyat bakal mentah2 telen kebijakan PPN 12%. Intinya dari awal ngapain ada kebijakan seperti itu kalau ga mikir kalau rakyat bakal terima2 aja. Bonus: Bisa ada yg main pahlawan jg,rakyat kira bego kayak pas pilpres kmaren mentah2 milih 02 jd pda kira rakyat bakal mentah2 telen kebijakan ppn 12 inti awal ngapain kebijakan itu kalau tidak mikir kalau rakyat bakal terima2 aja bonus ada main pahlawan jg
Sat Feb 15 16:54:14 +0000 2025,o_rsie,#KaburAjaDulu Bisa gak sik Kita stop dulu Kritik pemerintah Biarin aja dulu kita coba untuk tidak peduli Nantikan Muntah sendiri. PPN naik biarin. Gas Langka biarin. Ada kebijakan nyeleneh biarin. Menurut aku dengan kita #Biarinajadulu Akan mempercepat terjadinya perubahan.,tidak sik stop dulu kritik perintah biarin aja dulu coba tidak peduli nanti muntah sendiri ppn naik biarin gas langka biarin kebijakan nyeleneh biarin aku kita cepat jadi ubah
Sat Feb 15 16:36:17 +0000 2025,CakKhum,Kebijakan PPN 12 persen rakyat kecil hanya sapi perah semata untuk beragam pungutan pajak.,kebijakan ppn 12 persen rakyat kecil sapi perah semata agam pungut pajak
Sat Feb 15 16:25:00 +0000 2025,puddinstroy,@RezaUnscripted Lu yg tolol apa gimana dah kek gatau pejabat sini kalo bikin kebijakan aja. Kita ga berisik ya bakal diembat habis²an. Memori otak lu cuman 5kb kah? Ga inget yg dulu² itu kek PPN 12% yg endingnya juga gjd karena kita berisik. Stop melihat lgsg hasilnya liat dari awal prosesnya.,lu tolol apa bagaimana deh kek gatau penjabat sini kalau bikin kebijakan aja tidak berisik bakal embat habis an memori otak lu cuman 5kb tidak inget dulu kek ppn 12 endingnya gjd kita berisik stop lihat lgsg hasil liat awal proses
Sat Feb 15 15:08:47 +0000 2025,nkri_dlmberita,Gibran beler fix naik wapres PPN naik 12% terus dikasih pengali 11/12 Makanan Buruk Gizi (MBG) diadakan dan banyak kebijakan asbun bisa lolos walau sudah ramai apalagi kalau bungkam. Terus kita harus wow gitu lihat Pemerentah jadi pahlawan kesiangan? Awikwok moment mah itu.,gibran beler fix naik wapres ppn naik 12 terus kasih ali 11 12 makan buruk gizi mbg ada banyak kebijakan asal bunyi lolos sudah ramai kalau bungkam terus harus wow gitu lihat entah jadi pahlawan siang awikwok moment mah
Sat Feb 15 13:43:36 +0000 2025,mindplater,@uray_z @ardisatriawan nah karna huru hara ini ya pemerintah juga sadar kalo kebijakannya aneh sehingga ya kebijakan tsb ga ditetapin. bagusnya tuh ya karna huru hara trus viral tapi buruknya adalah kalo sampe ada yg doxing macam isu ppn kemarin,nah huru hara perintah sadar kalau kebijakan aneh ya kebijakan tsb tidak ditetapin bagus tuh ya karena huru hara trus viral buruk kalau sampe yang doxing macam isu ppn kemarin
Sat Feb 15 13:29:07 +0000 2025,diyamed2,@ardisatriawan come on gua lagi bahas kasus KIP-K itu mirip kek PPN 12% yang sebelum final udh pada ribut2 duluan sampe ada yg doxing segala. tapi efek ribut2 juga ada bagusnya untuk ketetapan kebijakan tersebut (ppn cuma untuk barang mewah dan KIP-K gajadi dipotong).,come on lagi bahas kasus kip itu mirip kek ppn 12 belum final udah ribut2 duluan sampe yang doxing segala efek ribut2 ada bagus tetap kebijakan sebut ppn cuma barang mewah kip gajadi potong
