created_at,username,full_text,cleaned_text
Sun Feb 23 01:07:08 +0000 2025,babyportgas,Gue usul harga diturunin. Gue sadar nurunin harga itu lebih bijak daripada properti dibiarin nganggur. Gue dari 2022 ga pernah naikin harga produk entah itu ada isu resesi ppn 12% dll. Jgn nambahin beban orang dgn harga yg kita pasang kalo kita masih bisa makan 3x sehari,gue usul harga diturunin gue sadar nurunin harga lebih kebijakan properti dibiarin nganggur gue 2022 tidak pernah naikin harga produk entah ada isu resesi ppn 12 lain jgn nambahin beban orang harga pasang kalau kita masih makan 3x hari
Sat Feb 22 12:21:25 +0000 2025,imloffxr,skrng klo belanja mendi ke toserba njir drpd ke alfa ada ppn nya monyet,sekarang klo belanja mendi toserba njir ke alfa ppn nya monyet
Thu Feb 20 12:43:56 +0000 2025,SyahrulDA2,@Uki23 Siapa bilang barang konsumsi tidak kena PPN? Pabriknya yg kena PPN lalu harga jual menjadi harga pokok yg disesuaikan dg tambahan PPN. Jadi yg bayar PPN tetap konsumen atau rakyat. Minyak goreng kecap saus bumbu2 kopi teh gula dan produk konsumtif lainnya. Mudheng po ora?,siapa bilang barang konsumsi kena ppn pabrik kena ppn lalu harga jual jadi harga pokok sesuai dg tambah ppn jadi bayar ppn tetap konsumen rakyat minyak goreng kecap saus bumbu2 kopi teh gula produk konsumtif lain mudheng po ora
Thu Feb 20 00:30:07 +0000 2025,PPNternate,Kunjungan ini bertujuan untuk meninjau fasilitas yang tersedia di PPN Ternate dan melihat peluang investasi usaha bidang perikanan serta pendistribusian produk hasil perikanan di wilayah Provinsi Maluku Utara pada umumnya. https://t.co/0E8oWjWpJh,kunjung tuju tinjau fasilitas sedia ppn ternate lihat peluang investasi usaha bidang ikan distribusi produk hasil ikan wilayah provinsi malu utara umum
Wed Feb 19 22:52:24 +0000 2025,jawapos,Kebijakan pajak pertambahan nilai ditanggung pemerintah (PPN DTP) sepertinya mengubah kinerja pengembang di Jawa Timur. Pengembang yang biasa meluncurkan proyek hunian kini fokus untuk menjual stok siap huni. Produk tersebut biasanya dipasarkan untuk konsumen generasi muda. PPN https://t.co/EaQ4AagcGm,kebijakan pajak tambah nilai tanggung perintah ppn dtp seperti ubah kerja kembang jawa timur kembang biasa luncur proyek huni kini fokus jual stok siap huni produk sebut biasa pasar konsumen generasi muda ppn
Mon Feb 17 10:48:10 +0000 2025,waannn______,@AkuntanMilenial @shidqi_zain Jd lu bilang retail bayar PPN itu benar tp bukan serta merta cuma retail yg bayarin PPN konsumennya si konsumen pun bakal bayar PPN bakal bayar juga artinya harga jual produk bakal naik juga dari harga aslinya.,jd lu bilang retail bayar ppn benar tp bukan merta cuma retail bayarin ppn konsumen si konsumen bakal bayar ppn bakal bayar arti harga jual produk bakal naik dari harga asli
Sun Feb 16 10:40:06 +0000 2025,plbkinvestasi,ada bapak bapak yang bertanya tanya sekarang belanja beginian juga ada PPN nya? Beliau ngga tahu kalau PPN itu sudah ada sejak lama harga yang kita beli sekarang itu dari produk produk sehari hari itu - kecuali sembako spt beras minyak goreng dah itu semuanya kena PPN.,bapak bapak tanya tanya sekarang belanja begini ppn nya beliau tidak tahu kalau ppn sudah ada sejak lama harga kita beli sekarang dari produk produk hari hari kecuali sembako spt beras minyak goreng deh semua kena ppn
Wed Feb 12 08:34:36 +0000 2025,kuterculik,Barang mewah yang dikenakan PPN 12% akan menghadapi risiko dikenai pajak ganda jika PPnBM juga berlaku. Hal ini akan meningkatkan harga barang secara signifikan yang tak hanya mengurangi konsumsi tetapi juga memengaruhi daya saing produk dalam negeri. https://t.co/eijtwngbWx,barang mewah kena ppn 12 hadap risiko kena pajak ganda ppnbm laku ini tingkat harga barang signifikan tak kurang konsumsi juga pengaruh daya saing produk negeri
Sun Feb 09 12:18:36 +0000 2025,kritxik,@irwndfrry PPN barang mewah yang naik bikin parno. Undang Raline Shah deh dia sering banget pakai produk lokal di acara besar pasti bisa kasih pandangan menarik.,ppn barang mewah naik bikin parno undang raline shah deh sering banget pakai produk lokal acara besar bisa kasih pandang tarik
Fri Feb 07 05:11:48 +0000 2025,IndiHomeCare,@huaakiyowo Untuk saat ini PPN atau Pajak Pertambahan Nilai produk dan layanan IndiHome tidak mengalami perubahan namun ada penyesuaian pada tampilan invoice dan faktur pajak mulai 1 Januari 2025. DM-nya udah diterima ya. Mohon tunggu konfirmasi selanjutnya via DM. Makasih -Emmy,saat ppn pajak tambah nilai produk layanan indihome alami ubah ada sesuai tampil invoice faktur pajak mulai 1 januari 2025 dm nya udah terima mohon tunggu konfirmasi lanjut via dm makasih emmy
Wed Feb 05 14:02:10 +0000 2025,opetpasipasip,Dampak kenaikan PPN 12% Dampak Perekonomian: Peningkatan Penerimaan Negara: Pemerintah menyatakan dari kenaikan tarif PPN untuk barang dan jasa mewah akan meningkatkan penerimaan negara Dorongan Produk Lokal: Kebijakan tarif baru PPN ini juga dinilai akan meningkat,dampak naik ppn 12 dampak ekonomi tingkat terima negara perintah nyata naik tarif ppn barang jasa mewah tingkat terima negara dorong produk lokal kebijakan tarif baru ppn juga nilai tingkat
Thu Jan 23 14:26:58 +0000 2025,HusnaDyah,@jichangminshine Udah ngetik nama produk ngitung harga per pcs nya.. Belum lagi dikurangi potongan.. Terus dikurangi lagi ppn .. Mumeeettt,udah ngetik nama produk ngitung harga per pcs nya rang potong terus rang lagi ppn mumeeettt
Thu Jan 23 08:08:01 +0000 2025,ciecie_ambis,@kring_pajak min kalau desember 2024 ada faktur pajak masukan produk dari LN dari sini nah tpi ga muncul di prepopulated min itu di tulis manual aja min dimana min?trs untuk pembayaran ppn nya ebilling nya dipisah atau di gabung dengan pembelian yg lain? kodenya smaa min? https://t.co/9ecgP0912N,min kalau desember 2024 faktur pajak masuk produk ln sini nah tpi tidak muncul prepopulated min di tulis manual aja min min terus bayar ppn nya ebilling nya pisah di gabung beli lain kode smaa min
Thu Jan 23 05:29:01 +0000 2025,xtxaxfxk,@swara1st @qxntolqu Indon produk kalian lagi sampah dari kami tu bukan produk kami tapi China indon lonte. Negara aja PPN 12% kok ngomel si indon ini.,indon produk kalian sampah tu bukan produk kami tapi china indon lonte negara aja ppn 12 kok ngomel si indon
Tue Jan 21 07:35:18 +0000 2025,halalindonesia_,Kepala BPJPH bertemu dengan Menteri PPN/Kepala Bappenas pagi tadi bahas soal pengembangan jaminan produk halal kedepan --- Pada kesempatan ini bahkan Menteri PPN/Kepala sebut Halal sebagai bentuk proteksi produk-produk dalam negeri... https://t.co/KA6952sMJ7,kepala bpjph temu menteri ppn kepala bappenas pagi tadi bahas soal kembang jamin produk halal depan sempat bahkan menteri ppn kepala sebut halal bentuk proteksi produk produk negeri
Tue Jan 21 00:59:22 +0000 2025,triindonesia,@DenmasRohiim @longjourney33 @tanyarlfes @Telkomsel Pagi kak Rohim. Perubahan masa aktif guna meningkatkan kualitas layanan sisi jaringan &amp; produk. Tentunya lebih stabil &amp; penggunaan lebih nyaman. Lalu harga sudah disesuaikan mekanisme penggunaan &amp; tidak berhubungan dengan PPN. Yuk pilih paket yang ada bima+ &amp; *888#. Thanks ^Fey,pagi kak rohim ubah masa aktif tingkat kualitas layanan sisi jaring amp produk tentu lebih stabil amp guna lebih nyaman lalu harga sesuai mekanisme guna amp hubung ppn yuk pilih paket ada bima amp 888 thanks fey
Mon Jan 20 22:51:36 +0000 2025,vaughn92828361,Apresiasi PPN 12 Persen Yang Tidak Menyasar 20 Produk Pertanian Dan Perikanan https://t.co/q2xIL874ag,apresiasi ppn 12 persen tidak sasar 20 produk tani ikan
Mon Jan 20 09:24:26 +0000 2025,aasikinn27,@politiknesiacom Fyi belanja di luar negeri beli produk yang tidak ada di produksi di Indonesia. Keliru jika anggap produk indo lebih mahal malahan produk luar negeri itu lebih mahal ada pajak BM ppn 12% pph 10% ppn impor 11% dll bukankah produk impor jd lebih mahal? @airlangga_hrt,informasi belanja luar negeri beli produk tidak produksi di indonesia keliru anggap produk indo lebih mahal malah produk luar negeri lebih mahal pajak bm ppn 12 pajak_penghasilan 10 ppn impor 11 lain bukankah produk impor jd lebih mahal
Sun Jan 19 10:45:02 +0000 2025,finansiologi,Contoh kasus kopi 80ribu disindir banyak orang tapi sekarang jualan kelas crypto nya kenceng Kasus 2 ex manager adidas di us yg sempet blunder bahas ppn 12% impact ke produk jualan budhal nya Ada yg punya info lebih jauh?,contoh kasus kopi 80ribu sindir banyak orang sekarang jual kelas crypto nya kenceng kasus 2 mantan manager adidas us sempet blunder bahas ppn 12 impact produk jual budhal nya yang punya info lebih jauh
Sun Jan 19 05:39:02 +0000 2025,Varnando0oo0,Tak perlu khawatir! PPN 12% hanya untuk produk mewah. Barang kebutuhan sehari-hari tetap aman dan terjangkau #PPN #IndonesiaEmas2045 https://t.co/63Lhq2gaO2,tak perlu khawatir ppn 12 untuk produk mewah barang butuh hari hari tetap aman terjangkau
Sun Jan 19 05:18:54 +0000 2025,SanjayKusnaidi,Tak perlu khawatir! PPN 12% hanya untuk produk mewah. Barang kebutuhan sehari-hari tetap aman dan terjangkau #PPN #IndonesiaEmas2045 https://t.co/PZmrxxMJIe,tak perlu khawatir ppn 12 untuk produk mewah barang butuh hari hari tetap aman terjangkau
Sat Jan 18 14:02:57 +0000 2025,Meme_Pemerintah,Penyesuaian PPN nggak hanya soal pajak tapi juga peluang besar buat UMKM Indonesia. Dengan penyesuaian yang lebih adil produk lokal bisa lebih bersaing harga jadi lebih kompetitif dan UMKM makin berkembang. #pajak #ppn #pajaknaik #pajak12persen #ppnnaik https://t.co/EqmoJOePj0,sesuai ppn hanya soal pajak juga peluang besar buat umkm indonesia sesuai lebih adil produk lokal lebih saing harga jadi lebih kompetitif umkm makin kembang
Sat Jan 18 13:44:40 +0000 2025,neuvillate,Penyesuaian PPN nggak hanya soal pajak tapi juga peluang besar buat UMKM Indonesia. Dengan penyesuaian yang lebih adil produk lokal bisa lebih bersaing harga jadi lebih kompetitif dan UMKM makin berkembang. #pajak #ppn #pajaknaik #pajak12persen #ppnnaik https://t.co/DOZuk1LCvi,sesuai ppn hanya soal pajak juga peluang besar buat umkm indonesia sesuai lebih adil produk lokal lebih saing harga jadi lebih kompetitif umkm makin kembang
Sat Jan 18 13:44:32 +0000 2025,ChristiAgui789,Penyesuaian PPN nggak hanya soal pajak tapi juga peluang besar buat UMKM Indonesia. Dengan penyesuaian yang lebih adil produk lokal bisa lebih bersaing harga jadi lebih kompetitif dan UMKM makin berkembang. #pajak #ppn #pajaknaik #pajak12persen #ppnnaik https://t.co/QRg8LNEWSz,sesuai ppn hanya soal pajak juga peluang besar buat umkm indonesia sesuai lebih adil produk lokal lebih saing harga jadi lebih kompetitif umkm makin kembang
Sat Jan 18 11:23:48 +0000 2025,PatriaReppi,Bener banget. Aku ngeluh ppn aja bilangnya kaya kamu udah kerja aja. Kita orang kecil ga bakal kena. Lah Padahal kontribusi aku ke negara adalah jajan mulu tiap hari baik itu produk lokal umkm mini/super market pasar atau impor,bener banget aku ngeluh ppn aja bilang kaya kamu udah kerja aja orang kecil tidak bakal kena lah padahal kontribusi aku negara jajan mulu tiap hari baik produk lokal umkm mini super market pasar impor
Sat Jan 18 11:06:10 +0000 2025,Zay34562,Tak perlu khawatir! PPN 12% hanya untuk produk mewah. Barang kebutuhan sehari-hari tetap aman dan terjangkau #PPN #IndonesiaEmas2045 https://t.co/d0oqUoXTkj,tak perlu khawatir ppn 12 untuk produk mewah barang butuh hari hari tetap aman terjangkau
Sat Jan 18 11:04:38 +0000 2025,CokissForYou,Tak perlu khawatir! PPN 12% hanya untuk produk mewah. Barang kebutuhan sehari-hari tetap aman dan terjangkau #PPN #IndonesiaEmas2045 https://t.co/vYJ4P4ZUq4,tak perlu khawatir ppn 12 untuk produk mewah barang butuh hari hari tetap aman terjangkau
Sat Jan 18 09:39:20 +0000 2025,kring_pajak,PPN 12% itu produk rezim Jokowi PDIP. Presiden Jokowi mengajukan ke DPR tanggal 5 Mei 2021 #SatuNegaraDuaPresiden #SatuNegaraDuaPresiden https://t.co/f2csSj5GQc,ppn 12 produk rezim jokowi pdip presiden jokowi aju dpr tanggal 5 mei 2021
Fri Jan 17 11:57:25 +0000 2025,RioOchou,@nuingyizho aman gx pake ppn karena bukan produk mahal,aman gx pake ppn bukan produk mahal
Fri Jan 17 08:36:20 +0000 2025,pajakkotabumi,@jokoraj Berdasarkan Surat Edaran tahun 1993 harga yg ditetapkan pada BBM sdh termasuk PPN sampai pd tingkat konsumen akhir dan PPN terutang sdh dikenakan pd saat penyerahan dr PERTAMINA maka bagi pengusaha lain selain PERTAMINA tdk perlu mengenakan PPN lagi atas produk tsb. (2/3),dasar surat edar tahun 1993 harga tetap bbm sdh masuk ppn pd tingkat konsumen akhir ppn utang sdh kena pd serah dr pertamina bagi usaha selain pertamina tidak perlu kena ppn atas produk tsb 2 3
Mon Jan 13 03:05:05 +0000 2025,DefiraRama94301,@papa_loren Jokorup jangan disamakan jokotarub udah ciptakan banyak peran figuran drama melindungi kong guan guna tampung produk cina di gudang PIK2 agar langsung dr cina ke gudang tanpa pemeriksaan tak kena ppn &amp; di sita neg karena rugikan pasar domistik kt gimana @_TNIAL_ @ditjenbeacukai https://t.co/vexogdN3nw,jokorup jangan sama jokotarub udah cipta banyak peran figuran drama lindung kong guan tampung produk cina gudang pik2 langsung dr cina gudang periksa tak kena ppn amp sita neg rugi pasar domistik kt bagaimana
Mon Jan 13 02:36:04 +0000 2025,metimecoffee93,[123] serta barang dan jasa yang menjadi objek pajak konsumsi tertentu seperti rokok produk tembakau mobil mewah dan playing card. c. Sistem PPN Indonesia lebih generous (banyak memberikan dukungan kepada masyarakat seperti kebutuhan pokok listrik dan air bersih)...,123 barang jasa jadi objek pajak konsumsi tentu rokok produk tembakau mobil mewah playing card c sistem ppn indonesia lebih generous banyak beri dukung masyarakat butuh pokok listrik air bersih
Mon Jan 13 02:36:01 +0000 2025,Rienty81,[118] a. Pada dasarnya Vietnam menerapkan multitarif PPN yaitu: - 10% standard rate - 5% untuk barang esensial seperti air bersih peralatan pendidikan buku bahan makanan obat alat medis pakan ternak produk dan jasa pertanian ...,118 a dasar vietnam terap multitarif ppn 10 standard rate 5 barang esensial air bersih alat pendidikan buku bahan makan obat alat medis pakan ternak produk jasa tani
Sun Jan 12 12:18:30 +0000 2025,Satrio_Prasetya,@Meme_Pemerintah Peningkatan PPN dapat mendukung pembenahan sistem perpajakan dan daya saing produk lokal.,tingkat ppn dukung benah sistem paja daya saing produk lokal
Sun Jan 12 07:30:05 +0000 2025,chrstnde,@bachrum_achmadi Manusia Goblok pajak yg mana? Semua rakyat itu bayar pajak bangsat Karena sifat pajak itu ada Pajak Langsung dan Pajak Tdk Langsung. Ppn itu pajak tdk langsung dan semua produk yg dikonsumsi rakyat mulai dari Listrik bensin bahkan cykai rokok itu Pajak namanya,manusia bodoh pajak mana semua rakyat bayar pajak sensor sifat pajak ada pajak langsung pajak tidak langsung ppn pajak tidak langsung semua produk konsumsi rakyat mulai listrik bensin bahkan cykai rokok pajak nama
Sat Jan 11 04:38:11 +0000 2025,cnbcindonesia,@GSWARIIors Fyi tempat gua kerja juga dah dikenakan PPN 12% naik sekitar 5-10k per produk,informasi tempat kerja deh kena ppn 12 naik 5 10k per produk
Sat Jan 11 03:51:05 +0000 2025,lupizlyz,@shulhirinjani @liputan6dotcom Rakyat sudah byar PPN 11 % setiap produk yang wajib PPN.. goblog,rakyat byar ppn 11 produk wajib ppn goblog
Fri Jan 10 12:44:44 +0000 2025,SMRKonsultan,Mau ppn ga jadi naik ataupun naik. Sbenernya sama aja harga produk apapun tiap tahun naik karna ump jg naik tiap tahun. Tp yg ga masuk akalnya ump naik ga nyampe 7%. Ini produk naiknya bisa 10-20%,mau ppn tidak jadi naik atau naik sbenernya sama aja harga produk apa tiap tahun naik ump jg naik tiap tahun tp tidak masuk akal ump naik tidak nyampe 7 produk naik 10 20
Fri Jan 10 08:59:38 +0000 2025,Ryotacan69,[34]Apa kriteria barang mewah yang akan dikenakan PPN 12%? Apakah produknya sama dengan produk yang terkena PPnBM atau ada tambahan? Apa saja list-nya? Pertanyaan ini serupa dengan pertanyaan berikut:,34 apa kriteria barang mewah akan kena ppn 12 produk sama produk kena ppnbm ada tambah apa list nya tanya rupa tanya ikut
Fri Jan 10 06:52:37 +0000 2025,AbudHendra,Gegara PPN! Produk Nikel Cs Jadi Mahal Jika Dijual ke Dalam Negeri https://t.co/8B9Ku16gfr,gegara ppn produk nikel cs jadi mahal jual dalam negeri
Fri Jan 10 01:05:08 +0000 2025,dimas_satura,@MadaSastro @tanyarlfes Pengen nge-iya-in. Tapi sulit kak. PPh udah otomatis dipotong kantor aku cuma tinggal lapor. PPN lebih gamungkin karena kita sebagai end user udah otomatis bayar barengan sama harga produk/jasanya. PKB kalo gadibayar kendaraan kita jadi bodong. Sulit kak,ken nge iya in sulit kak pajak_penghasilan udah otomatis potong kantor aku cuma tinggal lapor ppn lebih gamungkin end user udah otomatis bayar bareng sama harga produk jasa pkb kalau gadibayar kendaraan kita jadi bodong sulit kak
Wed Jan 08 17:20:31 +0000 2025,BNusantata,5/7 Manfaat Insentif Pajak untuk Industri Musik PPh (Pajak Penghasilan): pengurangan pajak hak cipta Tarif khusus kreator PPN (Pajak Pertambahan Nilai): Tarif rendah produk musik Pengecualian PPN untuk ekspor Gunakan insentif untuk efisiensi pajak #PajakKreatif https://t.co/uRz7ILv1L9,5 7 manfaat insentif pajak industri musik pajak_penghasilan pajak penghasilan kurang pajak hak cipta tarif khusus kreator ppn pajak tambah nilai tarif rendah produk musik kecuali ppn ekspor guna insentif efisiensi pajak
Wed Jan 08 11:50:23 +0000 2025,smartfrencare,@myXL Ini beneran paket extra combo plus naik semua min harganya? Apa gara2 ppn naik 12%! Apa iya kuota internet itu termasuk barang/produk mahal yg harus kena ppn bener2 g habis pikir,beneran paket extra combo plus naik semua min harga apa gara2 ppn naik 12 apa iya kuota internet masuk barang produk mahal harus kena ppn bener2 g habis pikir
Wed Jan 08 05:02:48 +0000 2025,HiFicares,5/9 Strategi #3: Diversifikasi Produk Kategori Pajak Rendah Tahukah Anda? Hasil pertanian &amp; makanan pokok = bebas PPN Produk kesehatan tertentu = tarif rendah Analisis kategori produk Anda. Pastikan klasifikasi sesuai regulasi pajak! #BisnisCerdas https://t.co/mOApaStRZr,5 9 strategi diversifikasi produk kategori pajak rendah tahu hasil tani amp makan pokok bebas ppn produk sehat tentu tarif rendah analisis kategori produk pasti klasifikasi sesuai regulasi pajak
Wed Jan 08 05:02:46 +0000 2025,Dwi53594939,4/9 Strategi #2: Fokus pada Produk Ramah Lingkungan Inovasi ramah lingkungan bisa menekan pajak! Pajak karbon lebih rendah Potongan PPN untuk produk daur ulang Kiat: -Gunakan bahan baku daur ulang -Rancangan produk hemat energi #InovasiHijau #Keberlanjutan https://t.co/AUkC0USf8t,4 9 strategi fokus produk ramah lingkung inovasi ramah lingkung tekan pajak pajak karbon lebih rendah potong ppn produk daur ulang kiat guna bahan baku daur ulang rancang produk hemat energi
Tue Jan 07 08:51:51 +0000 2025,PPNSumbagut,@AlnilamOmar @prabowo Pinternya nurunin ppn jdi 8% jdi produk dlm negrinya lebih menggiurkan,pinternya nurunin ppn jadi 8 jadi produk negrinya lebih giur
Tue Jan 07 07:14:48 +0000 2025,seungkwaifeu,Sri Mulyani memastikan tidak akan ada perubahan soal tarif PPN selain untuk barang-barang mewah. Artinya produk yang selama ini berlaku tarif PPN 11% misalnya sampo dan sabun tetap berlaku tarif PPN yang sama.,sri mulyani pasti akan ubah soal tarif ppn untuk barang barang mewah arti produk lama laku tarif ppn 11 misal sampo sabun tetap laku tarif ppn sama
Mon Jan 06 15:50:57 +0000 2025,jasa_isi_spt,@BNusantata Hi Kak. Beeru infoin PPn atau Pajak Pertambahan Nilai produk dan layanan Telkomsel tidak mengalami perubahan namun ada penyesuaian saja pada tampilan invoice dan faktur pajak mulai 1 Januari 2025. Makasih. -Beeru,hi kak beeru infoin ppn pajak tambah nilai produk layanan telkomsel alami ubah ada sesuai pada tampil invoice faktur pajak mulai 1 januari 2025 makasih beeru
Mon Jan 06 15:48:04 +0000 2025,davinaaig,@IndiHomeCare tagihan indihome bulan ini kok naik kena PPN 12%? Kan bukan produk dan jasa barang mewah.,tagih indihome bulan kok naik kena ppn 12 kan bukan produk jasa barang mewah
Mon Jan 06 12:11:19 +0000 2025,amira_syahira20,@onoseno @faisallte @kumparan @IndiHomeCare @onoseno Hi kak :) Merujuk kepada kebijakan pemerintah mengeni PPN 12% minfren infokan bahwa harga produk dan layanan smartfren tidak ada perubahan dan . Kami mohon maaf atas perubahan informasi yg sebelumnya dan terima kasih atas pengertian dan kesetiaannya. Terima kasih. El,hi kak rujuk kebijakan perintah ken ppn 12 minfren info harga produk layanan smartfren ada ubah kami mohon maaf atas ubah informasi belum terima kasih atas erti setia terima kasih el
Mon Jan 06 10:31:55 +0000 2025,mika_tahm1,@Kemendag @prabowo Dengan adanya PPN 12% Seharusnya yang di larang impor itu Jenis Produknya bukan menutup jalur ecommerce cross border pengiriman dari luar negeri ke Indonesia. Bedakan antara Pemakaian Pribadi dengan Perusahaan &amp; Seller/Reseller. Karena tidak semua Produk impor ada di jual UMKM.,ada ppn 12 yang larang impor jenis produk bukan tutup jalur ecommerce cross border kirim luar negeri indonesia beda pakai pribadi usaha amp seller reseller tidak semua produk impor di jual umkm
Mon Jan 06 08:43:02 +0000 2025,agus_whyd15,4/7 4️⃣ Strategi Efisiensi Pajak Perusahaan Pertanian Manfaatkan insentif PPN &amp; Pajak Final. Gunakan software untuk katat transaksi &amp; e-Filing. Dapatkan konsultan pajak berpengalaman. Dokumentasi rapi → Selalu pisahkan laporan tiap produk. #StrategiBisnis https://t.co/NuTFhXLYDQ,4 7 4 strategi efisiensi pajak usaha tani manfaat insentif ppn amp pajak final guna software katat transaksi amp e filing dapat konsultan pajak alam dokumentasi rapi selalu pisah lapor tiap produk
Mon Jan 06 08:42:59 +0000 2025,mikayla_tulipa,2/7 2️⃣ Jenis Pajak yang Berlaku: PPh Pasal 21: Untuk gaji karyawan. PPh Pasal 23 : Bayar konsultan atau kontraktor? Siapkan potongannya. PPh Pasal 25/29: Angsuran pajak &amp; pelaporan tahunan. ️Catatan: Produk tanaman pangan biasanya bebas PPN. #TipsPajak #Agribisnis https://t.co/P9GHlkgzJD,2 7 2 jenis pajak laku pajak_penghasilan pasal 21 gaji karyawan pajak_penghasilan pasal 23 bayar konsultan kontraktor siap potong pajak_penghasilan pasal 25 29 angsur pajak amp lapor tahun catat produk tanam pangan biasa bebas ppn
Mon Jan 06 08:42:58 +0000 2025,rina_wlndrii,1/7 1️⃣Kewajiban Pajak Pertanian: ️ Pajak Penghasilan (PPh) untuk karyawan &amp; laba bersih. ️ Pajak Pertambahan Nilai (#PPN): Tidak semua produk dikenakan #PPN! ️ Pajak Daerah: PBB &amp; kendaraan untuk transportasi hasil panen. ️ Pajak Final: Hanya 0 5% omzet di bawah Rp4 8 m https://t.co/gyukM2I0jW,1 7 1 wajib pajak tani pajak penghasilan pajak_penghasilan karyawan amp laba bersih pajak tambah nilai semua produk kena pajak daerah pbb amp kendaraan transportasi hasil panen pajak final 0 5 omzet bawah rp4 8 m
Mon Jan 06 05:48:27 +0000 2025,hana_suryani454,@caliefb1 @indosathifi Hi Kak HiMin infokan rencana kenaikan tarif PPN dari 11% menjadi 12% yang sebelumnya direncanakan mulai berlaku pada 1 Januari 2025 telah dibatalkan. Sehingga tarif PPN untuk produk dan layanan Indosat HiFi akan tetap sebesar 11% ya Kak. Salam ^^Moza,hi kak himin info rencana naik tarif ppn 11 jadi 12 belum rencana mulai laku 1 januari 2025 batal tarif ppn produk layanan indosat hifi tetap besar 11 kak salam moza
Mon Jan 06 05:16:37 +0000 2025,sarah_tirayah22,@efkudz Hi Kak HiMin infokan untuk rencana kenaikan tarif PPN dari 11% menjadi 12% yang sebelumnya direncanakan mulai berlaku pada 1 Januari 2025 telah dibatalkan. Sehingga tarif PPN untuk produk dan layanan Indosat HiFi akan tetap sebesar 11% ya Kak. Salam ^^Moza,hi kak himin info rencana naik tarif ppn 11 jadi 12 belum rencana mulai laku 1 januari 2025 batal tarif ppn produk layanan indosat hifi tetap besar 11 kak salam moza
Sun Jan 05 11:23:32 +0000 2025,pangga0908,@RoyalCanin_ID Hi royal canin ID..mau konfirmasi kok harga produk2 RC naik? Kan PPN ga jadi naik dan produk RC bukan tergolong barang mewah. Menurut toko pet supplies langganan ak mereka menaikkan harga krn dr pabriknya jg naik. Apakah benar begitu?,hi royal canin id mau konfirmasi kok harga produk2 rc naik kan ppn tidak jadi naik produk rc bukan golong barang mewah toko pet supplies langgan mereka naik harga krn dr pabrik jg naik benar
Sun Jan 05 09:39:04 +0000 2025,barengwarga,Melalui penandatanganan kerja sama ini Pertamina berkomitmen bahwa kualitas produk dan kepastian suplai dapat dicapai secara maksimal sehingga kegiatan-kegiatan operasional kepolisian dapat terlaksana dengan baik dan lancar Sob! #EnergizingYourJourney #Pertamina #PPNSumbagut https://t.co/ZCgPZLU410,lalu penandatanganan kerja sama pertamina komitmen kualitas produk pasti suplai capai maksimal giat giat operasional polisi laksana baik lancar sob
Sun Jan 05 07:15:52 +0000 2025,issssms,Pernah lihat kalo bank tuh emang ga boleh jual tiket gitu makanya bentuknya berupa produk macam ini tapi 15jt??? In this economy yang PPN 12% untuk barang mewah??? Sehat-sehat guys! Jangan mau jadi budak kapitalis yang berakhir mumet bayar hutang,pernah lihat kalau bank tuh emang tidak boleh jual tiket gitu makanya bentuk upa produk macam tapi 15jt in this economy ppn 12 barang mewah sehat sehat guys jangan mau jadi budak kapitalis akhir mumet bayar hutang
Sun Jan 05 04:13:31 +0000 2025,manikadeea,@MurtadhaOne1 mau bantu jawab yaa manteman semuanya itu emang secara aturan harus ditulis 12% namun perhitungannya menggunakan DPP Nilai Lain yaitu 11/12 dari Nilai Produk/Nilai Tagihan jadi PPN nya tetap sama senilai 11%. Untuk referensi bisa dibuka di PMK 131/2024 ya manteman,mau bantu jawab yaa manteman semua emang atur tulis 12 hitung guna dpp nilai yaitu 11 12 nilai produk nilai tagih jadi ppn nya tetap sama nila 11 referensi buka pmk 131 2024 manteman
Sun Jan 05 01:25:03 +0000 2025,majimafisipol,@dicky_novera Kenaikan PPN barang mewah mungkin mempengaruhi daya saing Indonesia di pasar internasional terutama untuk produk-produk mewah lokal.,naik ppn barang mewah mungkin pengaruh daya saing indonesia pasar internasional utama produk produk mewah lokal
